{
  "uiContract": "1.1.0",
  "baselineVersion": "2026-03-11.1",
  "captureStandard": {
    "locale": "en-US",
    "timezone": "America/Denver",
    "reducedMotion": true,
    "colorScheme": "light",
    "viewports": {
      "desktop": {
        "width": 1366,
        "height": 768
      },
      "tablet": {
        "width": 1024,
        "height": 768
      },
      "mobile": {
        "width": 390,
        "height": 844
      }
    }
  },
  "scenarios": [
    {
      "id": "start-ready-desktop",
      "route": "/",
      "screenId": "StartScreen",
      "state": "ready",
      "viewport": "desktop",
      "setupProfile": "publicCatalogSeeded",
      "status": "required"
    },
    {
      "id": "about-ready-desktop",
      "route": "/about",
      "screenId": "AboutScreen",
      "state": "ready",
      "viewport": "desktop",
      "setupProfile": "public",
      "status": "required"
    },
    {
      "id": "dashboard-ready-desktop",
      "route": "/dashboard",
      "screenId": "DashboardScreen",
      "state": "ready",
      "viewport": "desktop",
      "setupProfile": "learnerWithEnrollmentAndCatalog",
      "status": "required"
    },
    {
      "id": "dashboard-empty-desktop",
      "route": "/dashboard",
      "screenId": "DashboardScreen",
      "state": "emptyEnrolled",
      "viewport": "desktop",
      "setupProfile": "learnerNoEnrollment",
      "status": "required"
    },
    {
      "id": "dashboard-readonly-observer-desktop",
      "route": "/dashboard",
      "screenId": "DashboardScreen",
      "state": "readonlyObserver",
      "viewport": "desktop",
      "setupProfile": "observerOnLearner",
      "status": "required"
    },
    {
      "id": "classroom-learner-ready-desktop",
      "route": "/course/:courseId/topic/:topicId",
      "screenId": "ClassroomScreen",
      "state": "ready",
      "viewport": "desktop",
      "setupProfile": "learnerInClassroom",
      "status": "required"
    },
    {
      "id": "classroom-editor-mode-desktop",
      "route": "/course/:courseId/topic/:topicId",
      "screenId": "ClassroomScreen",
      "state": "editorMode",
      "viewport": "desktop",
      "setupProfile": "editorInClassroom",
      "status": "required"
    },
    {
      "id": "classroom-observer-readonly-desktop",
      "route": "/course/:courseId/topic/:topicId",
      "screenId": "ClassroomScreen",
      "state": "readonlyObserver",
      "viewport": "desktop",
      "setupProfile": "observerInClassroom",
      "status": "required"
    },
    {
      "id": "metrics-ready-desktop",
      "route": "/metrics",
      "screenId": "MetricsScreen",
      "state": "ready",
      "viewport": "desktop",
      "setupProfile": "metricsSeeded",
      "status": "required"
    },
    {
      "id": "progress-ready-desktop",
      "route": "/progress",
      "screenId": "ProgressScreen",
      "state": "ready",
      "viewport": "desktop",
      "setupProfile": "progressSeeded",
      "status": "required"
    },
    {
      "id": "course-creation-ready-desktop",
      "route": "/courseCreation",
      "screenId": "CourseCreationScreen",
      "state": "ready",
      "viewport": "desktop",
      "setupProfile": "editor",
      "status": "required"
    },
    {
      "id": "course-export-ready-desktop",
      "route": "/courseExport",
      "screenId": "CourseExportScreen",
      "state": "ready",
      "viewport": "desktop",
      "setupProfile": "editorWithCourse",
      "status": "required"
    },
    {
      "id": "error-403-desktop",
      "route": "/error/403",
      "screenId": "ErrorScreen",
      "state": "403",
      "viewport": "desktop",
      "setupProfile": "public",
      "status": "required"
    },
    {
      "id": "error-404-desktop",
      "route": "/error/404",
      "screenId": "ErrorScreen",
      "state": "404",
      "viewport": "desktop",
      "setupProfile": "public",
      "status": "required"
    },
    {
      "id": "classroom-learner-ready-mobile",
      "route": "/course/:courseId/topic/:topicId",
      "screenId": "ClassroomScreen",
      "state": "ready",
      "viewport": "mobile",
      "setupProfile": "learnerInClassroom",
      "status": "recommended"
    },
    {
      "id": "dashboard-ready-mobile",
      "route": "/dashboard",
      "screenId": "DashboardScreen",
      "state": "ready",
      "viewport": "mobile",
      "setupProfile": "learnerWithEnrollmentAndCatalog",
      "status": "recommended"
    }
  ]
}
